Title,Tags,Author,Source,News Text
Gold hits all-time high as Fed rate-cut hopes bolster appeal,"['markets', 'commodities', '']",", Anushree Ashish Mukherjee","Reporting by Anushree Mukherjee in Bengaluru and Polina Devitt in London; Editing by Christina Fincher, Krishna Chandra Eluri and Alan Barona","Sept 12 (Reuters) - Gold prices rose more than 1% to hit a record high on Thursday, helped by expectations of an interest rate cut by the Federal Reserve next week after U.S. data signalled a slowing of the economy. Spot gold was up 1.7% at $2,554.05 per ounce, as of 02:10 p.m. ET (1810 GMT). U.S. gold futures settled 1.5% higher at $2,580.60. The U.S. Labor Department said initial claims for state unemployment benefits   2,000 to a seasonally adjusted 230,000. U.S. producer prices   slightly more than expected in August amid higher costs for services, but the trend remained consistent with subsiding inflation. ""We are headed towards a lower interest rate environment so gold is becoming a lot more attractive ... I think we could potentially have a lot more frequent cuts as opposed to a bigger magnitude,"" said Alex Ebkarian, chief operating officer at Allegiance Gold. Markets are currently pricing in an 73% chance of a 25-basis-point U.S. rate cut at the Fed's Sept. 17-18 meeting, and a 27% chance of a 50-bps cut, the CME FedWatch tool showed. Zero-yield bullion tends to be a preferred investment amid lower interest rates. ""The labor market is continuing to falter and if the labor market deteriorates, the journey that they'll embark on in cutting rates is going to go for an extended period of time,"" said Phillip Streible, chief market strategist at Blue Line Futures. Elsewhere, palladium gained 4.1% to $1,050 per ounce, hitting its highest in over two months. Russian President Vladimir Putin said on Wednesday that Moscow should consider   of uranium, titanium and nickel in retaliation against the West. ""Palladium is the market that is up for a short-covering rally. Putin did not mention palladium. But since the metal is a by-product of Russian nickel production, such export curbs could drive down production of both metals and deepen the current deficit in the palladium market,"" said WisdomTree commodity strategist Nitesh Shah. Spot silver up 3.7% at $29.76 and platinum gained 3% to $979.62, hitting its highest level in near two months."
TSX notches record high as Fed easing boosts liquidity prospects,"['markets', '']",", Fergal Smith",Reporting by Fergal Smith in Toronto and Nikhil Sharma in Bengaluru; Editing by Leroy Leo and Alistair Bell,"Sept 19 (Reuters) - Canada's main stock index climbed to a record high on Thursday, led by technology and commodity-linked stocks, as investors bet that the Federal Reserve's outsized interest rate cut could spur a shift from cash into riskier assets globally. The Toronto Stock Exchange's S&P/TSX composite index   ended up 273.67 points, or 1.2%, at 23,866.27, eclipsing Monday's all-time closing high.  also rallied after the Fed kicked off its easing cycle on Wednesday with a half-percentage-point reduction in rates, rather than a quarter-percentage-point move. ""Traders seem to have decided to take the rate cut news as positive for liquidity, overshadowing concerns that rate cuts could be a sign of a weakening economy,"" Colin Cieszynski, chief market strategist at SIA Wealth Management, said in a note. Lower U.S. interest rates reduce the cost of borrowing U.S. dollars. The Fed's move could also encourage other central banks, such as the Bank of Canada, to cut rates at a faster pace, analysts say. The technology sector rose 3%, helped by a gain of 5.6% for electronic equipment company Celestica Inc  . Energy was up 1.9% as the price of oil settled 1.5% higher at $71.95 a barrel. Gold and copper prices also rose, leading to gains for metal mining stocks. The materials group, which includes metal miners and fertilizer companies, added 1.6%.  will retire next year and hand over the job to the head of its Canadian banking unit Ray Chun, as Canada's second-biggest lender braces for expected U.S. fines for weakness in its anti-money laundering protocols. Shares of TD   rose 2.4%, while the financials sector ended 1.3% higher."
TSX rises for fourth day on supersized Fed rate cut bets,"['markets', '']",", Nikhil Sharma,   , Fergal Smith",Reporting by Fergal Smith in Toronto and Nikhil Sharma in Bengaluru; Editing by Leroy Leo and Devika Syamnath,"Sept 16 (Reuters) - Canada's commodity-linked main stock index rose to an all-time high on Monday, led by gains for energy and technology shares, as expectations rose the Federal Reserve would cut U.S. interest rates by half a percentage point at a policy decision this week. The Toronto Stock Exchange's S&P/TSX composite index   ended up 133.42 points, or 0.6%, at 23,702.07, its fourth straight day of gains and eclipsing the record closing high it posted on Friday.  have priced in a nearly 60% chance of a 50 basis-point rate cut by the Fed on Wednesday, rather than a quarter-point move, up from 45% last Friday. ""It's probably the first cut of many to come"" and that gives a boost to the resource-heavy Canadian market for a number of reasons, said Allan Small, senior investment advisor at Allan Small Financial Group with iA Private Wealth. Zero-yielding gold and other dollar-denominated commodities tend to benefit from lower U.S. interest rates. Gold rose to a record high and   settled 2.1% higher at $70.09 a barrel. The energy group advanced 1%, heavily-weighted financials added 0.7% and technology ended 1% higher. Bausch Health Companies   shares jumped 10.6% after a report that its Bausch + Lomb unit was exploring sale options.    shares gained 3.5% after the company said on Sunday it has reached a tentative, last-minute deal with its pilots' union over a new four-year collective agreement, averting a near-term strike or lockout."
"Gold at over one-week low on firm dollar, US payrolls data awaited","['markets', 'commodities', '']",", Anushree Ashish Mukherjee",Reporting by Anushree Mukherjee in Bengaluru; Editing by Sharon Singleton and Mohammed Safi Shamsi,"Sept 3 (Reuters) - Gold prices eased to their lowest in more than a week on Tuesday, pressured by a firm dollar, while investors awaited U.S. non-farm payrolls data that could determine the size of the potential cut in the Federal Reserve's September policy meeting. Spot gold fell 0.4% to $2,490.44 per ounce by 1:52 a.m. ET (1752 GMT).U.S. gold futures settled 0.2% lower to $2,523.00. The dollar   rose 0.2%, hitting a two-week high, making gold more expensive for other currency holders. ""We see evidence that speculative positioning in gold is effectively maxed out for the time being..I think the level to which gold is seeing pressure from the rise in the dollar reflects our view on positioning,"" said Daniel Ghali, commodity strategist at TD Securities. Focus will be on Friday's U.S. payrolls report along with ISM surveys, JOLTS job openings and the ADP employment report due later this week. Markets are pricing in a 63% chance of a 25 basis point (bps) cut when the Fed meets on Sept. 17 and 18, with a 37% probability of a 50-bps cut, the   showed. ""If the U.S. jobs report is significantly weaker, speculation about a U.S. recession and faster rate cuts will resurface, further supporting gold,"" Commerzbank said in a note. Bullion is heading for its best year since 2020, driven by investor optimism about upcoming U.S. rate cuts and lingering concerns about the  . Gold ""remains our preferred hedge against geopolitical and financial risks, with additional support from imminent Fed rate cuts and ongoing emerging market central bank buying. We open a long gold trade recommendation,"" Goldman Sachs said. Spot silver dipped 1.8% to $27.99, platinum fell 2.2% to $909.55 and palladium lost nearly 4% to $941.00."
Putin's commodities ban threat puzzles Russian firms and officials,"['markets', 'europe', '']",", Gleb Bryanski, ,  , Darya Korsunskaya,   , Gleb Stolyarov","Reporting by Gleb Bryanski, Dasha Korsunskaya, Gleb Stolyarov; writing by Gleb Bryanski; editing by Guy Faulconbridge and Kevin Liffey","MOSCOW, Sept 12 (Reuters) - Russian officials and managers are perplexed by President Vladimir Putin's   to limit exports of strategic commodities in response to Western sanctions, and wonder if it can be realised without hurting Russia more than the West. Putin made the suggestion 23 minutes into a routine government meeting on Wednesday, asking Prime Minister Mikhail Mishustin to come up with some ideas that would not harm Russia's interests. Yet many of Russia's commodities such as oil, gas, nickel, titanium, gold and diamonds are already subject to various levels of voluntary or mandatory import restrictions or even bans imposed by the West itself. Russian government officials and company executives were caught off guard. ""Everyone is in a state of shock,"" said a source in one of the affected companies, who spoke on condition of anonymity due to the sensitivity of appearing to criticise the president. ""This initiative came really out of the blue."" Another company source said: ""It's like shooting yourself in the foot."" Cutting exports of uranium, nickel and titanium - which Putin mentioned explicitly - would cut the foreign currency earnings of Russia's biggest firms including state-owned industrial conglomerate Rostec, state nuclear monopoly Rosatom and Nornickel, the world's top producer of refined nickel. Together, they employ about a million people, and their revenues have already been affected by Western sanctions. Nornickel's   first-half profit fell by 22% as it tries to pivot its exports to Asia. It has described the combination of low nickel prices and Western sanctions as a ""perfect storm"". The global market price of nickel did blip upwards on Putin's comments - but the current wealth of supply means it is far below historic highs. A Russian government source, who also spoke on condition of anonymity, said any ban should spare so-called ""friendly"" countries including China, Russia's major trading partner. The source stressed that it would take some time for the government to develop the plan - and that an order from the president to do so had yet to reach the government. Another source close to the government added that Putin had ""asked for a plan to be worked out, not implemented"". Major Russian commodities producers declined to comment. Russia and the West are entering   over the Ukraine war and Russia is pondering ways to respond to what it says is almost certain Western approval for Ukraine to strike deep into Russia using Western weapons. Putin said that if Russia went ahead, the measure would not be limited to uranium, nickel and titanium. He noted that Russia has 22% of the world's natural gas reserves, 23% of gold reserves, and 55% of global diamond reserves. Uranium may be the one commodity where restrictions could genuinely hurt the West. Russia accounted for 27% of the enriched uranium supplied to U.S. commercial nuclear reactors last year. While the U.S. has in theory banned imports of the fuel from Russia, it also provided for waivers through 2027 as it expands its own enrichment facilities. Yet Europe has largely weaned itself off the Russian gas it used to depend on. Group of Seven and European Union bans on imports of Russian-origin diamonds forced Moscow to buy up diamonds from its sanctions-hit producer, Alrosa  . And all Russia's major gold producers are already under Western sanctions. Meanwhile, Russia's largest titanium sponge maker VSMPO-AVISMA, partly owned by Rostec, has been struggling to find replacements for supplies of titanium concentrate from Ukraine, with which Russia is at war. Putin himself emphasised that restrictions would not happen ""tomorrow"", and that they must not harm Russia's interests. On Friday, Kremlin spokesman Dmitry Peskov stressed the as-yet hypothetical nature of the idea. ""There are no specifics yet, it was a proposal to think about it without harming ourselves, without damaging our own interests,"" he said. ""They (the government) will consider it."""
"India's trade deficit widens in August on spike in gold imports, weak exports","['world', 'india', '']",", Shivangi Acharya,   , Manoj Kumar","Reporting by Shivangi Acharya; Additional reporting by Rajendra Jadhav in MUMBAI; Editing by Nivedita Bhattacharjee, Alexandra Hudson","NEW DELHI, Sept 17 (Reuters) - India's merchandise trade deficit in August widened to a ten-month high of $29.65 billion after gold imports surged while exports fell, dragged down by climbing shipping costs and sluggish global demand. Economists had expected the country's August trade deficit to be $23 billion, according to a Reuters poll. The deficit stood at $23.5 billion in the previous month. ""Exports are facing huge challenges on current global circumstances,"" Trade Secretary Sunil Barthwal told reporters, in regard to the monthly trade data. Rising shipping costs and a slowdown in China coupled with recessionary trends in Europe and the US were also impacting exports, he said. Outbound shipments from the world's fifth-largest economy fell 9.3% year-on-year, for the second month in a row, to $34.71 billion last month, data showed, while imports increased by 3.3% to $64.36 billion. Monthly gold imports in August surged more than three times to $10.06 billion compared to the previous month, partly due to an increase in domestic demand, a senior commerce ministry official said. In value terms, August gold imports were the highest since March 2021, when they had touched $8.5 billion, according to Reuters calculations. Gold imports through official channels have also gone up after a cut in the import tariff to 6% from 15% in the budget in July, discouraging gold smuggling, the official said. Services exports in August were estimated at $30.69 billion, and imports at $15.70 billion, compared with $28.71 billion and $15.09 billion, respectively, a year ago. India's total goods and services exports for the fiscal year 2023/24, which ended in March, stood at nearly $776 billion while imports for the same period were nearly $855 billion. Exporters said Indian goods exports have been impacted by the escalating US-China trade war and rising freight costs, besides a fall in global commodity prices. ""Freight costs for Indian exporters' shipping goods to Europe and the U.S. have more than doubled in the past year, driven by disruptions in the Red Sea,"" said Ajay Srivastava, founder of the Delhi-based think tank Global Trade Research Initiative. The think-tank has urged the government to take steps to strengthen domestic shipping lines and container production, noting that over 90% of India's merchandise exports were dependent on global carriers like Maersk [RIC:RIC:APMOLM.UL], MSC and COSCO [RIC:RIC:COSCO.UL]. The  , in a report earlier this month, urged the Indian government to reduce import tariffs and integrate into global value chains to boost exports, noting the country's manufacturing firms had not fully seized opportunities from China's exit from these sectors. The trade secretary said the trade deficit was not a matter of concern for an emerging economy like India. ""There is a huge consumption demand coming from the economy, which is growing at double the rate of other countries,"" Barthwal said."
TSX hits a 3-week low as jobs data stokes growth concerns,"['world', 'americas', '']",", Fergal Smith",Reporting by Fergal Smith in Toronto and Nikhil Sharma in Bengaluru; Editing by Vijay Kishore and Jonathan Oatis,"Sept 6 (Reuters) - Canada's main stock index fell to a more than three-week low on Friday, weighed by declines in technology and commodity-linked shares, as U.S. and Canadian jobs data added to investor concerns about a slowdown in the economy. The Toronto Stock Exchange's S&P/TSX composite index   ended down 206.85 points, or 0.9%, at 22,781.43, its fourth straight day of declines and its lowest closing level since Aug. 13. For the week, the index lost 2.4%, its first weekly decline in five weeks. Major U.S. indexes posted even steeper declines on Friday. ""Investors are pricing in the reality of slower economic growth,"" said Philip Petursson, chief investment strategist at IG Wealth Management. ""You look at what's going on across the cyclical sectors, whether it's energy, materials, industrials, consumer discretionary, they're all down.""  increased less than expected in August and   rose to 6.6%, its highest level in more than seven years after excluding the pandemic years of 2020 and 2021. ""The (Canadian) economy isn't growing fast enough to absorb the new labor entrants, and that's a concern,"" Petursson said. The energy sector fell 1.5% as the price of   extended its recent declines, settling 2.1% lower at $67.67 a barrel. Gold and copper prices also fell, weighing on metal mining shares. The materials sector, which includes miners and fertilizer companies, ended 2% lower. Technology fell 1.7%, with shares of Celestica Inc   tumbling 10.2% to a seven-month low. Enghouse Systems Ltd   was a bright spot. Shares of the application software company climbed 5.6% on better-than-expected quarterly earnings. Japanese retail giant Seven & I Holdings   said it had turned down Alimentation Couche-Tard's   $38.5 billion cash bid, rejecting an offer that would be the largest-ever foreign buyout of a Japanese company. Shares of Couche-Tard ended 1.9% higher."
"Reports of dollar's demise are greatly exaggerated, JPMorgan says","['markets', 'us', '']",", Marc Jones","Reporting by Marc Jones
Editing by Christina Fincher","LONDON, Sept 4 (Reuters) - Suggestions that the dollar's dominance of the global financial system is ending are wide of the mark, JPMorgan said on Wednesday, despite some dramatic signs of change in commodity markets and certain trading blocs. China's rise and the use of economic sanctions on the likes of Russia mean there is a trend of diversification away from the dollar, JPMorgan said, but reasons for the U.S. currency's dominance remain ""well-entrenched and structural in nature"". It pointed to the rising amounts of dollar-denominated bank deposits in emerging markets, sovereign wealth fund behaviour and non-reserve foreign assets, saying it ""more than offset"" the dollar's secular decline in overall emerging market FX reserve holdings. The dollar's share in total world liabilities is still on the rise too thanks to record amounts of debt issuance and even talk of de-dollarization in China appeared ""exaggerated"" despite geopolitical rivalry. ""Meaningful erosion of dollar dominance is likely to take decades, and the decline in the dollar's share of global trade and overall FX reserve holdings should not be confused with de-dollarization,"" the investment bank's report said. Areas where significant changes are happening include commodities markets where oil trading is increasingly done in non-USD currencies and demand from central banks and emerging market consumers for gold has boomed. The most ""underappreciated risk to USD hegemony"" was a possible fragmentation of the international payments system where the dollar has long been all powerful, the bank argued. China and India are the global leaders in terms of e-commerce innovation and activity whereas the U.S. and Western Europe's share is now less than 30%. Washington's use of tough financial sanctions means Russia, China and other countries are building alternatives to the SWIFT bank-to-bank system. Dozens of central banks are piloting new digital versions of their national currencies that could also make avoiding the U.S. banking system easier. ""The genuine confidence of the private sector in the dollar as a store of value seems uncontested,"" JPMorgan's report said. ""However, we are witnessing greater diversification and important shifts in cross-border transactions as a result of sanctions against Russia, China’s efforts to bolster usage of the renminbi, and geoeconomic fragmentation."""
"Gold drops as dollar, yields firm after US inflation report","['markets', 'commodities', '']",", Anushree Ashish Mukherjee",Reporting by Anushree Mukherjee and Swati Verma in Bengaluru; Editing by Krishna Chandra Eluri and Shreya Biswas,"Aug 30 (Reuters) - Gold slipped 1% on Friday as the dollar and Treasury yields firmed after U.S. inflation data matched expectations, but the bullion is set for a monthly gain as a September interest rate cut by the Federal Reserve remains in play. Spot gold fell 0.9% to $2,497.53 per ounce as of 01:42 p.m. ET (1742 GMT) and U.S. gold futures settled 1.3% lower at $2,527.6. Bullion gained 2% this month after prices rallied to an all-time high of $2,531.60 on Aug. 20. Data earlier in the day from the Commerce Department showed the personal consumption expenditures (PCE) price index rose 0.2% last month, matching economists' forecasts. The PCE data confirms inflation is no longer the Fed's main concern, as they have shifted their focus to unemployment, which further validates the potential rate cuts in September, said Alex Ebkarian, chief operating officer at Allegiance Gold. Investors now look ahead to the U.S. non-farm payroll report due next week. ""Next week will solidify whether or not we have a 50- or 25-basis-point interest rate cut at the September meeting,"" said Phillip Streible, chief market strategist at Blue Line Futures. Traders slightly raised bets of a 25-basis-point rate reduction by the Fed next month to 69%, with a 50-bps cut possibility coming down to 31% following the inflation report, according to the  . Physical demand remained lacklustre is top Asian consumers as new import   failed to lift Chinese demand. ""Systematic trend followers are effectively max-long. We also think that Shanghai positioning is near its record highs. That is despite the fact that physical demand in China has been fairly weak and inflows from Chinese gold ETFs as well,"" said Daniel Ghali, commodity strategist at TD Securities. Downside risks are significantly more elevated in the near term, given the fact that positioning looks extremely stretched, Ghali said. Spot silver eased 2.2% to $28.78 per ounce and platinum fell 1.2% to $926.65. Both the metals registered monthly losses. Palladium retreated 1.7% to $963.34, but posted a 4.3% monthly gain."
UK's FTSE 100 drops on steep slump in commodity-linked stocks,"['world', 'uk', '']",", Khushi Singh","Reporting by Khushi Singh, Ankika Biswas in Bengaluru; Editing by Sonia Cheema and Jonathan Oatis","Sept 3 (Reuters) - The UK's benchmark FTSE 100 tumbled on Tuesday to the lowest levels in over a week, hurt by a steep sell-off in commodity-linked stocks over lower metal and crude prices. The blue-chip FTSE 100 index   ended 0.8% lower, its biggest one-day decline in two weeks. The domestically focused mid-cap FTSE 250   also lost 0.8%, touching its lowest levels in three weeks. The precious metal miners   touched near one-month low with a 3.7% fall, as gold prices eased on a firm dollar. Heavyweight industrial metal miners   hit near six-month lows with a 3.4% fall. The index was pressured by the lowest copper prices in nearly two weeks, driven down by concerns that a weak Chinese economy is curbing demand. The oil and gas   index slipped 2.9% to its lowest levels since March after crude prices dropped following a media report of a potential end to a dispute in Libya, weighing on the supply-demand ratio. The personal care, drug and grocery stores   index led gains with a 1% jump, helped by a 3.1% rise in online supermarket and technology group Ocado  , while retailer Tesco   added 1.6% on a price target upgrade from UBS. Watches Of Switzerland Group   jumped 6.3% after the company said it's on track to deliver its full-year forecast, taking the personal goods   index higher by 0.4%. Rolls-Royce   rose 1.7% after Hong Kong's Cathay Pacific Airways   noted that the three of the 48 British engine supplier's planes under inspection went through   and all of the jets were expected to resume operation by Saturday. Meanwhile, British   are expected to rise significantly over the next two years, outpacing inflation. However, affordability for first-time buyers may improve due to anticipated lower borrowing costs, according to a Reuters poll."
