Title,Tags,Author,Source,News Text
"Gold rally to boost profits for miners Newmont, Barrick","['markets', 'commodities', '']",", Arunima Kumar",Reporting by Arunima Kumar in Bengaluru; Editing by Saumyadeb Chakrabarty,"July 24 (Reuters) - Newmont Corp   and Barrick Gold Corp  , the top two gold miners of the world, are expected to post higher quarterly profits, powered by a rally in the precious metal's prices. Rising hopes of a U.S. interest rate cut in September, uncertainty around U.S. elections and global geopolitical risks have boosted bullion's safe-haven appeal, pushing it to a  . ""We are expecting a very strong second quarter, given the significant increase in the gold price and relatively flat cost expectations,"" analysts at brokerage TD Cowen said. During the April-June quarter, spot gold averaged $2,335.87 per ounce, 18% higher than the same period last year. NYSE Arca Gold Miners Index  , which tracks the gold-mining industry, has risen about 20% so far, versus a 16.5% rise in the benchmark S&P 500  . As commodity prices remain strong, the market will be watching for mining companies to demonstrate stability in production and costs in the quarter and discipline and rationality in their growth plans, BMO Capital Markets analyst Jackie Przybylowski said. Barrick, in its quarterly production snapshot last week, said it expects its gold and copper output to progressively increase each quarter through the year with a higher weighting in the second-half. It cited the ramp-up of the Pueblo Viejo project expansion in Dominican Republic and improvements at Nevada Gold Mines for the outlook. With costs holding steady, second-quarter margins (Barrick) are set to benefit from an increase of about $250 per ounce in gold prices sequentially, and anticipate a meaningful operational improvement in the third-quarter, said analysts at Jefferies. Newmont is traditionally weighted to second-half due to weather impacts, Przybylowski said. The top miner is expected to report 1.56 million ounces gold production for second quarter, nearly 26% higher than last year, according to LSEG data. Newmont is expected to report quarterly results on Wednesday, while rival Barrick Gold is scheduled for August 12."
Toronto market ends lower but adds to weekly winning streak,"['markets', '']",", Fergal Smith","Reporting by Fergal Smith in Toronto and Nikhil Sharma in Bengaluru; Editing by Shreya Biswas, Vijay Kishore and Aurora Ellis","July 19 (Reuters) - Canada's resource-heavy stock index ended lower for a third straight day on Friday as commodity prices fell and investors weighed the impact of a global technology outage, but the market still held on to a modest weekly gain. The Toronto Stock Exchange's S&P/TSX composite index   ended down 36.37 points, or 0.2%, at 22,690.39, after steeper declines on Wednesday and Thursday. For the week, the TSX was up 0.1%, its fourth straight weekly advance, after posting on Tuesday a record closing high at 22,995.39. ""We are having a quiet, low volatility day. Given the carnage in the markets and the disruptions to technology around the world, it's not a bad thing,"" said Colin Cieszynski, chief market strategist at SIA Wealth Management.  added to their recent sell-off as a global tech outage   operations across industries, from airlines and broadcasting to healthcare and banking. The Toronto market's heavily weighted financials sector fell 0.4%, while energy was down 0.9% as the price of   settled 3.25% lower at $80.13 a barrel on the potential for a ceasefire in Gaza. The materials group  , which includes metal miners and fertilizer companies, lost 0.4% as gold and copper prices fell. Nutrien Ltd  , the world's largest potash producer, will stop blending fertilizers in Brazil after deciding to shut its last two active processing plants in the country, said three people familiar with the latest phase of a major turnaround effort. The company's shares ended 0.5% lower. Some of the defensive orientated sectors notched gains, with healthcare rising 0.8% and consumer staples ending up 1.2%.  fell 0.8% in May from April, a bigger decline than expected, boosting prospects of the Bank of Canada cutting interest rates further at a policy decision on Wednesday."
UK stocks end with weekly losses as commodity-linked stocks weigh,"['world', 'uk', '']",", Purvi Agarwal,   , Roshan Abraham",Reporting by Purvi Agarwal and Roshan Abraham in Bengaluru; Editing by Sohini Goswami and Andrew Heavens,"July 19 (Reuters) - London stocks finished the week lower amid a global cyber outage on Friday as investors assessed a fall in domestic retail sales in June, while commodity-linked stocks dropped, tracking declines in prices of copper, gold and other metals. The blue-chip FTSE 100 index   was down 0.6%. The mid-cap FTSE 250   was off 0.8%. Both indexes snapped two weeks of consecutive gains. LSEG Group  , which runs the London Stock Exchange, said its Workspace news and data platform, regulatory news service and currency spot and forward prices   by the outage caused by a ""third-party global technical issue"". By midday in London, most of those issues seemed to have been resolved. Securities trading on the London Stock Exchange was not affected. Mining stocks weighed heavily on the blue-chip index as prices of precious and base metals fell on weaker China demand and expectations of a U.S. interest rate cut in September. Precious metal miners   fell 
 0.8
 %, with Fresnillo   falling 1.4% in sync with a decline in spot gold prices . Industrial metal miners   were down 1.7% after copper prices hit a more than three-month low in the absence of Chinese stimulus measures. Aerospace and defence stocks   were the only outliers with a 0.7% gain amid the broader declines after senior executives from British defence firms, including BAE   and Babcock  , met Ukrainian President Volodymyr Zelenskiy to discuss the need to   for his country in its conflict with Russia. Investors parsed through   that showed a bigger than expected 1.2% drop in June, following slower wage growth data and inflation at the Bank of England's 2% target. The retail data pushed up bets of an August cut to 43%, up from roughly 39% on Thursday. 0#BOEWATCH Personal goods   and retail   stocks fell 5.3% and 0.3% respectively. In the week ahead, the focus will shift to corporate earnings in the United States and the UK, with all eyes on U.S. inflation numbers ahead of the Federal Reserve's next monetary policy meeting. Shares of non-life insurer Beazley Plc   also fell 3.3% which RBC analysts cited to fears of losses arising from Microsoft cloud outage."
Golden rule: Why younger investors are drawn to gold,"['markets', 'wealth', '']",", Chris Taylor",Editing by Lauren Young,"NEW YORK, July 18 (Reuters) - What asset class do millennials and Gen Z investors both want to own? Here is an answer you may not have guessed: Gold. Among wealthy investors under the age of 43, 45% own gold as a physical asset, and another 45% are interested in holding it, according to a recent study by Bank of America Private Bank. Those are far higher percentages than other age groups. Usually this demographic is not interested in assets like gold, cash or Treasuries, because they are considered to be ""boring,"" says Liz Young Thomas, head of investment strategy for digital financial services firm SoFi. ""As Treasury yields rise, cash is paying a high interest rate, and gold is rising along with it. We are seeing returns we normally don’t see in such a short period of time,"" Thomas says. ""Naturally, when assets have strong returns, younger audiences start to perk up.” This confirms another study by money managers State Street, which finds that millennials have the highest allocation to gold in their portfolios, at 17%, far outpacing both boomers and Gen X at 10%. So what is going on? Why are younger investors so intrigued by a somewhat stodgy asset that has been around for thousands of years? Part of gold’s renewed buzz is its healthy spot price, which as of this writing  . It is also increasingly on the shelves in popular retail environments, which boosts visibility. Big-box chain Costco started selling 1-oz gold bars last fall and has been doing a brisk trade of up to $200 million monthly, according to Wells Fargo estimates. Since younger investors’ interest has been piqued, what golden rules should they keep in mind? A few thoughts from the experts: Part of the appeal of gold is that it is tangible. If the world’s financial system happens to go haywire, or currencies collapse, at least you would have something real to hold onto. “I have found with my millennial clients that as they get wealthier, they are more interested in investing in directly-held, self-custodied gold,” says Eric Amzalag, a financial planner in Canoga Park, California, whose clients tend to use online precious metals retailer APMEX. That is because investment goals often shift from growth to capital preservation, Amzalag adds. With physical gold you have unique challenges like: finding a reputable dealer who won’t take advantage of you; getting it delivered and stored securely; insuring your purchase; And then figuring out how to eventually sell it, since Costco is not about to buy that gold bar back from you. To protect your portfolio, check out   from the World Gold Council. An exchange-traded fund – either backed by physical gold, or one that invests in gold futures – takes away the problems of buying, storing and selling. It also makes asset exposure relatively easy. “There are some fees associated with that, but ETFs are a nice alternative if you don’t want to actually take delivery of bullion and hold it in your basement,” says SoFi’s Thomas. The largest such ETF, SPDR Gold Shares ( ), carries an expense ratio of 0.4% and boasts one-year returns of more than 23%. A similar approach is to buy an ETF comprised of mining stocks, such as VanEck Gold Miners ( ), which includes the biggest names in the sector like Newmont Corp. and Barrick Gold. Gold can certainly serve a purpose in a portfolio, as an uncorrelated asset and a potential hedge against inflation or volatility. But, as a commodity, it can also be quite volatile and fall in and out of favor with investors. As such, equities should still be the main portfolio entrée for most investors, experts say. Companies that generate sales, earn profits, pay dividends and offer potential share-price appreciation make for a more dynamic asset class with superior long-term returns. As for gold, younger investors may keep it as a complementary side dish, says Jonathan Cameron, a financial planner in Miami. “We work with many young professionals, and we have been including a gold ETF (about 5%) in many of our clients’ portfolios as a hedge for several years,” Cameron says. “Everyone likes this decision.”"
"Exclusive: Traders face $1 billion loss on faltering Ghana cocoa supply, sources say","['markets', 'commodities', '']",", Maytaal Angel,   , Maxwell Akalaare Adombila","Reporting by Maytaal Angel in London, Maxwell Akalaari Adombile in Accra, and Ange Aboa in Abidjan; Editing by Dmitry Zhdannikov and Emelia Sithole-Matarise","LONDON/ACCRA, July 15 (Reuters) - Trading houses face losses of at least $1 billion on cocoa derivatives after major producer Ghana failed to deliver beans this year, forcing traders to liquidate short positions in a rallying market, six industry sources told Reuters. Global cocoa prices soared this year after bad weather, bean disease, smuggling and illegal gold mining reduced production and the volume of beans available in Ghana, the world's No.2 producer. Chocolate prices also rose globally and chocolate makers have reduced the size of products such as bars as a result of the huge cocoa price increase. Ghanaian authorities, who sell all of the country's beans, want to delay delivery of up to   this season - nearly half of the cocoa beans they sold - due to Ghana's devastated crop, five sources told Reuters last month. Ghana's cocoa regulator said the country was looking to roll over ""some volumes, but not in those quantities"". A delay of 350,000 tons means cocoa traders and processors could face losses of about $4,000 per ton on cocoa futures they had bought to hedge their physical bean purchases, or around $1.4 billion combined, the sources said. Trade houses like Cargill [RIC:RIC:CARG.UL], Olam   and Barry Callebaut   use the futures market to hedge or lock in a price for cocoa they have not yet sold on to chocolate makers. ""We're sitting staring at our screens, barely trading,"" said the head cocoa trader at a global trading house specialising in agricultural commodities, speaking on condition of anonymity because he was not authorised to talk to the media. He said trading in the global cocoa physical and futures market has just about ground to a halt as a result of the deep losses and uncertainty. Much of Ghana's cocoa is bought by large, diversified trade houses with deep pockets, including Sucden, Olam, Barry Callebaut  , Cargill, Touton and Ecom. Traders typically sign deals to buy beans - like any other commodity - months in advance in the hope of reselling later at a profit. By doing so they take a so called long position in the physical market. As they wait for the physical commodity to be delivered for weeks or months they need to protect themselves against possible price falls. They typically do this by taking short positions in the futures market to protect against losses on a long position. Short trading bets on price falls so when the physical commodity arrives, long and short positions cancel each other out, guaranteeing a fixed price. The strategy unravels, however, if physical delivery - in this case cocoa beans - is delayed in a rallying market. If this happens, traders are forced to liquidate short positions for the month they had expected the commodity to arrive and take a new short position for the month of a new expected delivery. Doing so in April 2024 - after the market realised Ghana would delay bean delivery to 2025 - would have been costly, according to the traders. The six sources said last year traders who bought physical beans for May 2024 delivery would have taken equivalent short positions in May 2024 futures at around $3,000 a ton. With the market rallying in April 2024, those traders had to liquidate May 2024 shorts - or buy the futures back - at $11,000 a ton, facing losses of $8,000 a ton. As traders still hope to get the cocoa and need to protect themselves in the physical market, they had to take on new short positions for May 2025 delivery, which in April 2024 traded around $7,000 a ton. That means that if and when traders get their physical cocoa next May at $3,000 a ton, they will still face an aggregate loss of $4,000 per ton. The cocoa market is facing a third successive year of deficit and prices have roughly doubled this year. Traders will try to recoup at least some of their losses by charging chocolate makers like Hershey   and Mondelez   higher prices for products like cocoa powder and butter, said a top trader at a global agri-commodity trade house. Chocolate firms will likely struggle to pass on these costs to cash-strapped consumers who are already buying   in response to price rises. Market liquidity has also decreased because of exchanges asking traders to post more cash as collateral to cover their hedges, one of the traders said. This liquidity crunch has fuelled price fluctuations or volatility, he added. The collateral, known as a margin call, is set by the futures exchange as a down payment that covers a portion of the potential losses traders might face on their futures position. The higher the futures price, the higher the margin calls."
"Global stock index falls with bond yields, dollar after US inflation data","['markets', '']",", Sinéad Carew,   , Marc Jones","Additional reporting by Sinéad Carew, Noel Randewich, Karen Brettell, Gertrude Chavez-Dreyfuss, Marc Jones in London, Tom Westbrook in Singapore; editing by David Evans, Chris Reese, Diane Craft and Rod Nickel","NEW YORK/LONDON, July 11 (Reuters) - A global index of stocks edged down and bond yields fell on Thursday after U.S. inflation data boosted bets on interest-rate cuts while the yen surged against the dollar, raising questions about whether Japan intervened to boost its currency. U.S. Treasury yields dropped across the board after   unexpectedly slipped 0.1% in June after being unchanged in May, while the annual increase was the smallest in a year, reinforcing views that inflation was abating. The report followed U.S. Federal Reserve Chair   to lawmakers on Capitol Hill that ""more good data"" would build the case for interest-rate cuts. ""The CPI print is the big macro driver today. Any way you look it's encouraging news. It's further evidence that basically gets the Fed across the finish line to that level of confidence to initiate rate cuts,"" said Garrett Melson, portfolio strategist at Natixis in Boston. Despite the supportive data,   two biggest indexes fell as investors rotated into lower-weighted interest-rate-sensitive sectors such as real estate   and utilities   and out of heavy-weight sectors such as technology  , which has already rallied this year. The interest-rate-sensitive small cap Russell 2000 index   rallied more than 3%. Since investors now believe that the Fed is ready to start cutting interest rates, Sam Stovall, chief investment strategist at CFRA Research suggested they are already placing their bets without having to ""wait for them to actually do it."" The Dow Jones Industrial Average   rose 32.39 points, or 0.08%, to 39,753.75. But the S&P 500   lost 49.37 points, or 0.88%, to 5,584.54 and the Nasdaq Composite   lost 364.04 points, or 1.95%, to 18,283.41, with both snapping long winning streaks. The benchmark S&P's decline followed six straight record-high closes while the Nasdaq's retreat on Thursday ended a seven-session streak of closing records. MSCI's gauge of stocks across the globe   fell 0.76 points, or 0.09%, to 824.01 after rising about 0.7% to a record high earlier in the day. Europe's STOXX 600   index earlier closed up 0.6%. In  , the dollar dropped, with the Japanese yen at one point gaining more than 2% against the greenback as traders priced in the likelihood of U.S. rate cuts. The yen move was so steep that there was speculation about whether Japan had moved to shore up the currency, which fell last week to a 38-year low against the greenback. Japan's TV Asahi, citing government sources, reported that Japanese authorities had intervened. But the country's top currency diplomat Masato Kanda said he was not in position to comment on whether authorities had intervened, according to a Jiji Press report. The dollar index , which measures the greenback against a basket of currencies including the yen and the euro, fell 0.48% to 104.47. The euro was up 0.31% at $1.0864. Against the Japanese yen , the dollar weakened 1.75% at 158.84. And Sterling strengthened 0.51% at $1.291 after hitting an almost one-year high as comments from   policymakers and better-than-forecast GDP data led traders to reduce bets on an August rate cut in Britain. In Treasuries, after the inflation data U.S. two-year to 10-year yields slid to their lowest since mid-March, while those on 20-year and 30-year bonds sagged to two-week troughs. The yield on benchmark U.S. 10-year notes fell 7.4 basis points to 4.206%, from 4.28% late on Wednesday. The 30-year bond yield fell 5.6 basis points to 4.4144% from 4.47% late on Wednesday. The 2-year note yield, which typically moves in step with interest-rate expectations, fell 12 basis points to 4.513%, from 4.633% late on Wednesday. In commodity trading,   edged higher after the inflation data. U.S. crude settled up 0.6%, or 52 cents at $82.62 a barrel and Brent rose to $85.40 per barrel, up 0.4%, or 32 cents. Spot gold , added 1.82% to $2,414.27 an ounce. U.S. gold futures gained 1.77% to $2,414.10 an ounce as the precious metal was bolstered by the prospect of rate cuts."
"Zimbabwe will stick to promises to build trust in new currency, central bank chief says","['markets', 'currencies', '']",", Nyasha Chingono","Reporting by Nyasha Chingono;
Editing by Kopano Gumbi, Alexander Winning and Mark Potter","HARARE, July 17 (Reuters) - Zimbabwe's government will stick to what it promised when it launched a new currency in April by ensuring it remains fully backed by reserves, the central bank governor told Reuters on Wednesday, adding that was the only way to build trust. The new currency, called Zimbabwe Gold or ZiG for short, is the southern African country's sixth attempt at a local currency in 15 years after a bout of hyperinflation under former leader Robert Mugabe. The last currency, the Zimdollar, fell 80% in the three months before it was scrapped, and authorities face an uphill battle to convince a sceptical population to stop transacting in foreign currencies. ""Confidence can only come with us walking the talk,"" Governor John Mushayavanhu said in an interview, referring to the central bank's commitment not to print money to finance government spending, which drove previous currency collapses. He said the government had a plan until 2030 to increase use of the ZiG and build up gold and foreign exchange reserves, which stood at $285 million when the currency was launched and now exceed $380 million. The ZiG is currently used in about 20% of local transactions, compared with 80% for foreign currencies. ""We want to gradually tilt that ratio to 70:30 by year-end or 60:40 thereafter, until we get to a situation where everybody is indifferent as to which currency they are using. This is the roadmap,"" Mushayavanhu said. Although the government says use of the ZiG is rising, there are widespread reports of shortages of the currency in shops. Mushayavanhu said enough ZiG notes had been printed to satisfy public demand and that the bank's reserve accumulation strategy could accelerate as commodity prices rise. The central bank has been converting royalties paid by mining companies into gold and is targeting 3 tons of gold in its reserves by year-end, up from 2.5 tons in April. Mushayavanhu said authorities expected inflation to end the year around 5%, versus an International Monetary Fund estimate of 7%. ""For the first time our numbers are almost aligned to those of the IMF,"" he said. ""Let's embrace our new currency and make it work."""
